ID,text
569,please remove from your mailing list. interested. tuesday march wrote
269,interested dont contact krishnan wrote
785,interested dont contact again krishnan wrote
283,please remove from your list. krishnan wrote
161,unsubscribe krishnan wrote
330,unsubscribe krishnan wrote
694,unsubscribe krishnan wrote
409,please remove from your mailing list. need reply confirm. tue krishnan wrote
495,sorry dont think this something would interested krishnan wrote
541,please remove from your email list. thanks. mon krishnan wrote
936,thanks getting touch. this stage dont have need your services will keep your information file this changes. renee june krishnan wrote
738,please unsubscribe mon krishnan wrote
237,unsubscribe. tue wrote
557,unsubscribe tue krishnan wrote
753,unsubscribe tue krishnan wrote
855,unsubscribe tue krishnan wrote
532,please remove krishnan wrote
125,unsubscribe thursday krishnan wrote
683,take your email list krishnan wrote
953,unsubscribe wed krishnan wrote
724,hello interested this discussion. please remove information from your mailing. regards chris wed krishnan wrote
155,don t need product engineering services. have excellent engineering te. please remove from your mailing list. mon krishnan wrote
857,please unsubscribe from your prospecting list mon krishnan wrote
949,interested. please remove from your list. thanks luis sent from iphone krishnan wrote
234,please remove from your list. dave krishnan wrote
126,hello. interested never interacted with vijay best have sent emails which ignored because indeed interested . please remove from your mailing list permanently. tara kelly fri krishnan wrote
618,sp unsubscribe krishnan wrote
351,unsubscribe. sent from iphone krishnan wrote
921,unsubscribe sent from iphone wrote
808,unsubscribe. monday july krishnan wrote
687,please remove from your mailing list immediately miles tinsley managing director claimable krishnan wrote
723,interested. please remove from your lists. thank krishnan wrote
588,remove from your sales contact list. john wrote
333,didn t back because wasn t interested. kindly remove from your mailing list. regards patrice peyremyschool ltdm mlt w march krishnan wrote
895,interested please remove from your list. rushabh mehta jan krishnan wrote
247,thank you. interested.
400,interested thank wrote
940,thanks interested krishnan wrote
971,currently interested. please unsubscribe thanks kurt sent from iphone wrote
89,please remove mon krishnan wrote
963,skyler left company please remove from your mailing lists. thanks. thu krishnan wrote
517,take your list. thanks wed wrote
226,please take this list. fri krishnan wrote
787,thanks getting touch we re interested right now i ll touch that changes. best erica fri krishnan wrote
659,appropriate prospect you. please remove from your outreach list. mon krishnan wrote
706,i ll keep your information file kindly remove from your email list thanks thu krishnan wrote
139,we re interested this time. thanks. krishnan wrote
732,thanks your email. interested this time. krishnan wrote
997,interested this time .thank you. krishnan wrote
688,please don t contact about recruiting contracting. best those please unsubscribe mailing lists. john newton alfresco software founder johnnewton krishnan wrote
512,sorry have need your services. please take your mailing list. thanks manos concursive corporation norfolk krishnan wrote
430,thanks note we re working with right now we re good fit. would please take your email followup list i ll keep mind when things change they always rose june krishnan wrote
507,many thanks your interest toytalk however interested these kinds services this time. that should change future then will back you. cheers martin. mon krishnan wrote
158,remove from mailing list tean andersen executive assistant president mission support center north th court milwaukee office cell connect linkedin page
914,please remove from your list contact again. spmer plan business with you. raphael wed krishnan wrote
77,since mail filter clearly working i ve marked your previous emails sp maybe sarcasm will remove from your mailing list. patrice peyremyschool ltdm mlt w june krishnan wrote
231,interested right now thanks. wrote
323,hiring moment will keep mind should things change. best steve krishnan wrote
279,thanks covered. remove from your list. ad liebfounder skype adslieb thu krishnan wrote
677,your message violation canada s anti sp laws. will remove ne from mailing lists have contact future. brian krishnan wrote
839,this sp. take your list. fri krishnan wrote
612,interested thanks mon krishnan wrote
697,interested. thanks mon krishnan wrote
786,interested. mon krishnan wrote
675,thanks reaching looking this time. will keep your email mind anything changes. regards binod wed wrote
451,we re going outsourcing shop. i ll know that changes. thanks matt thu krishnan wrote
142,thanks email interested. tue krishnan wrote
337,interested tue krishnan wrote
354,interested. tue wrote
693,interested. tue krishnan wrote
274,please unsubscribe accounts neighborly.com krishnan wrote
611,remove from your list. don t recruiters kind. thanks mark intrepid.io fri krishnan wrote
802,interested. wed krishnan wrote
834,interested. wed krishnan
214,interested. fri krishnan wrote
260,develoent in house. that changes i ll know. schiffman jobscience january krishnan wrote
524,aren t interested right that changes i ll certainly touch. thanks bradley boven chief technology officer xsell technologies mon wrote
223,thanks reaching out. moment looking services such those provided your company. however should that change future will reach you. best wishes thu krishnan wrote
180,please remove from your list. thanks eric eric turnnessen ceo founder membermouse x mon krishnan wrote
48,thank interested. please remove from your mailing list. from krishnan sent friday january craig santoli subject planning conversation hello craig take care enterprise advisory services contractiq high touch matchmaking services product engineering initiatives. work with some world s leading tech companies identify software develoent partners their mobile analytics initiatives. aggregate data innovative work that s being done over software develoent tes pick most relevant tes your initiatives. we re trusted over companies who ve rolled bitious software initiatives based love plan conversation your plans . would have some time early next week best krishnan advisor enterprise tech contractiq web phone skype k curated mobile. from mobile trenches contributions outsource image removed sender.
35,thank please take your list. please know contact info. thanks tue krishnan wrote
880,interested right now. tue krishnan wrote
755,hiring product develoent house this isn t good fit. kindly unsubscribe from your outreach list. michael wilson founder small world labs phone . . efax . . twitter wilsonmichael fri krishnan wrote
213,this isn t relevant please take your list. friday july krishnan wrote
249,interested thanks sent from iphone krishnan wrote
758,interested sent from iphone wrote
592,please remove from your lists. july pdt krishnan wrote
436,interested thanks reaching out wed krishnan wrote
944,thanks your note. this time very satisfied with internal te existing partners there need speak. will keep your info case needs change future. wed krishnan wrote
59,interested this this time. thanks your outreach. mon krishnan wrote
883,thanks your email . currently need outsourcing services. anything changes will email you. best steve copertino digital from strategy through execution progr management tue krishnan wrote
933,thanks reaching out. looking outside help currently will reach needs change. thanks best pooja fri sarika doshi wrote
66,please remove from your list. charles mount onehub email phone . . ext. www.onehub.com mon krishnan wrote
284,thank reaching interested this time. tue krishnan wrote
646,tech company please remove information from your database martin krishnan wrote
70,thank we re interested. friday january krishnan wrote
799,interested wednesday march krishnan wrote
959,thank elaborating. after discussion this track currently hold. this changes i ll report back. kind regards frank schuil mon krishnan wrote
146,remove being mobile naushad huda krishnan wrote
456,thank you interested your services this time. please remove from your list. thanks from krishnan sent tuesday july martin subject speak hello tim looking through linkedin ce across your profile there. keep this introduction really short we re highly personalized curation that helps companies picking right tes mobile web product engineering. save companies from frustrating outsourcing experiences that common. doing this scale tes countries top them introduced super critical product initiatives. wonder this relevant your context. love catch there common interests. would have some time this week quick call best krishnan outreach strategic partnerships lead web phone skype k curated mobile. from mobile trenches contributions outsource
